{
  "recruiting_intro": "연무동에서 4/18(금) 저녁 7시에 가볍게 식사할 4명을 모집해요. 퇴근 후 혼자 먹기 아쉬운 분들, 편하게 와서 맛있게 한 끼 하고 가세요. 초면도 환영합니다.",
  "join_approval": "신청 감사해요. 4/18(금) 19:00 연무동 식당 앞에서 봬요. 자리 확정됐어요.",
  "day_of_notice": "오늘 저녁 7시 연무동 식당에서 봬요. 혹시 늦으시면 미리 알려주시고, 편한 차림으로 오세요. 비 소식이 있으니 우산 챙기시면 좋아요.",
  "post_thanks": "오늘 연무동 저녁 모임 함께해 주셔서 고맙습니다. 다음에도 또 편하게 뵐 수 있기를 기대할게요."
}
