{
  "recruiting_intro": "연무동에서 4/18(금) 저녁 7시에 같이 밥 드실 4명 찾고 있어요. 저도 동네 또래 호스트라 거창한 자리는 아니고 편하게 한 끼 나누는 모임이에요. 부담 없이 신청 부탁드려요.",
  "join_approval": "신청 감사드려요. 4/18(금) 19:00 연무동 식당 앞에서 뵐게요. 자리 확정됐어요.",
  "day_of_notice": "오늘 19시에 연무동에서 뵐게요~ 편하게 오시고, 혹시 늦으실 것 같으면 편하게 알려주세요. 날씨 쌀쌀해서 겉옷 챙기시면 좋아요!",
  "post_thanks": "오늘 같이 저녁 해주셔서 고마웠어요! 덕분에 즐거운 시간이었어요. 다음에 동네에서 또 편하게 뵐 수 있으면 좋겠어요."
}
